{"$schema":"http://json-schema.org/draft-07/schema#","$id":"exam-profile.schema.json","type":"object","required":["schema_version","id","track_id","version","evidence_status","question_count","section_sizes","weights"],"properties":{"schema_version":{"const":1},"id":{"type":"string","minLength":1},"track_id":{"type":"string","minLength":1},"version":{"type":"string","minLength":1},"evidence_status":{"enum":["official-verified","project-reference-unverified","observational"]},"question_count":{"type":"integer","minimum":1},"section_sizes":{"type":"array","minItems":1,"uniqueItems":true,"items":{"anyOf":[{"type":"integer","minimum":1},{"const":"all"}]}},"weights":{"type":"object","minProperties":1,"additionalProperties":{"type":"number","minimum":0}}},"additionalProperties":false}
